half,time-minutes,time-seconds,details,player1-id,player2-id,player1-linkable,player2-linkable,player3-linkable,player-first-name-1,player-first-name-2,player-last-name-1,player-last-name-2,player-team-alias-1,player-team-alias-2,home-score,visitor-score,visitor-fouls,home-fouls,player-fouls,fastbreak,in-paint,second-chance,off-turnover,player-score,points-type,detail-id,detail-desc,event-id,event-desc,distance,x-coord,y-coord,team-id-1,team-id-2,team-id-3
1,20,00,Start of the 1st Half,,,false,false,false,,,,,,,0,0,0,0,0,,,,,0,,,,14,Start Period,,,,79,79,
1,19,40,Amir Williams makes a hook shot from 8 feet out.,110165,,true,false,false,Amir,,Williams,,OhioSt,,2,0,0,0,0,,,,,2,2,55,Hook Shot,3,Field Goal Made,8,7.4,3.8,79,79,
1,19,04,Alex Olah misses a 3-point jump shot from 24 feet out.,116199,,true,false,false,Alex,,Olah,,NW,,2,0,0,0,0,,,,,0,3,45,Jump Shot,4,Field Goal Missed,24,.3,23.7,78,78,
1,19,04,Lenzelle Smith Jr. with a defensive rebound.,97510,,true,false,false,Lenzelle,,Smith Jr.,,OhioSt,,2,0,0,0,0,,,,,0,,,,6,Defensive Rebound,,,,79,79,
1,18,58,Lenzelle Smith Jr. with a bad pass turnover: Bad Pass,97510,,true,false,false,Lenzelle,,Smith Jr.,,OhioSt,,2,0,0,0,0,,,,,0,,1,Bad Pass,7,Turnover,,,,79,79,
1,18,36,Alex Olah makes a layup shot.,116199,,true,false,false,Alex,,Olah,,NW,,2,2,0,0,0,,,,,2,2,40,Layup Shot,3,Field Goal Made,0,0,0,78,78,
1,18,15,Amir Williams misses a jump shot from 7 feet out.,110165,,true,false,false,Amir,,Williams,,OhioSt,,2,2,0,0,0,,,,,2,2,45,Jump Shot,4,Field Goal Missed,7,.1,7.4,79,79,
1,18,15,Alex Olah with a defensive rebound.,116199,,true,false,false,Alex,,Olah,,NW,,2,2,0,0,0,,,,,2,,,,6,Defensive Rebound,,,,78,78,
1,18,04,Drew Crawford misses a 3-point jump shot from 23 feet out.,88698,,true,false,false,Drew,,Crawford,,NW,,2,2,0,0,0,,,,,0,3,45,Jump Shot,4,Field Goal Missed,23,-.6,22.9,78,78,
1,18,04,Aaron Craft with a defensive rebound.,97508,,true,false,false,Aaron,,Craft,,OhioSt,,2,2,0,0,0,,,,,0,,,,6,Defensive Rebound,,,,79,79,
1,17,51,Aaron Craft makes a layup shot.,97508,,true,false,false,Aaron,,Craft,,OhioSt,,4,2,0,0,0,,,,,2,2,40,Layup Shot,3,Field Goal Made,0,0,0,79,79,
1,17,13,Alex Olah misses a jump shot from 6 feet out.,116199,,true,false,false,Alex,,Olah,,NW,,4,2,0,0,0,,,,,2,2,45,Jump Shot,4,Field Goal Missed,6,2.8,5.2,78,78,
1,17,13,Alex Olah with an offensive rebound.,116199,,true,false,false,Alex,,Olah,,NW,,4,2,0,0,0,,,,,2,,,,5,Offensive Rebound,,,,78,78,
1,17,11,Alex Olah makes a jump shot from 6 feet out.,116199,,true,false,false,Alex,,Olah,,NW,,4,4,0,0,0,,,,,4,2,45,Jump Shot,3,Field Goal Made,6,4.8,4.2,78,78,
1,16,58,Shooting foul committed by Kale Abrahamson.,116198,,true,false,false,Kale,,Abrahamson,,NW,,4,4,1,0,1,,,,,0,,2,Shooting,8,Foul,,,,78,78,
1,16,58,Lenzelle Smith Jr. misses free throw 1 of 2.,97510,,true,false,false,Lenzelle,,Smith Jr.,,OhioSt,,4,4,1,0,0,,,,,0,1,11,Free Throw 1 of 2,2,Free Throw Missed,,,,79,79,
1,16,58,OhioSt with an offensive rebound.,,,false,false,false,,,,,,,4,4,1,0,0,,,,,0,,,,5,Offensive Rebound,,,,79,79,
1,16,58,Lenzelle Smith Jr. makes free throw 2 of 2.,97510,,true,false,false,Lenzelle,,Smith Jr.,,OhioSt,,5,4,1,0,0,,,,,1,1,12,Free Throw 2 of 2,1,Free Throw Made,,,,79,79,
1,16,39,Sanjay Lumpkin with a lost ball turnover: Lost Ball,116200,,true,false,false,Sanjay,,Lumpkin,,NW,,5,4,1,0,0,,,,,0,,2,Lost Ball,7,Turnover,,,,78,78,
1,16,30,Aaron Craft misses a jump shot from 13 feet out.,97508,,true,false,false,Aaron,,Craft,,OhioSt,,5,4,1,0,0,,,,,2,2,45,Jump Shot,4,Field Goal Missed,13,11.5,6.2,79,79,
1,16,30,Kale Abrahamson with a defensive rebound.,116198,,true,false,false,Kale,,Abrahamson,,NW,,5,4,1,0,1,,,,,0,,,,6,Defensive Rebound,,,,78,78,
1,16,23,Personal foul committed by Sam Thompson.,110164,,true,false,false,Sam,,Thompson,,OhioSt,,5,4,1,1,1,,,,,0,,1,Personal,8,Foul,,,,79,79,
1,16,18,Drew Crawford makes a 3-point jump shot from 23 feet out. Alex Olah with the assist.,88698,116199,true,true,false,Drew,Alex,Crawford,Olah,NW,NW,5,7,1,1,0,,,,,3,3,45,Jump Shot,3,Field Goal Made,23,22.9,4.3,78,78,
1,15,58,Personal foul committed by Kale Abrahamson.,116198,,true,false,false,Kale,,Abrahamson,,NW,,5,7,2,1,2,,,,,0,,1,Personal,8,Foul,,,,78,78,
1,15,58,Official TV timeout.,,,false,false,false,,,,,,,5,7,2,1,0,,,,,0,,3,Official TV,11,Timeout,,,,79,79,
1,15,55,Shannon Scott misses a 3-point jump shot from 23 feet out.,110162,,true,false,false,Shannon,,Scott,,OhioSt,,5,7,2,1,0,,,,,0,3,45,Jump Shot,4,Field Goal Missed,23,23,2.1,79,79,
1,15,55,Lenzelle Smith Jr. with an offensive rebound.,97510,,true,false,false,Lenzelle,,Smith Jr.,,OhioSt,,5,7,2,1,0,,,,,1,,,,5,Offensive Rebound,,,,79,79,
1,15,54,Shooting foul committed by JerShon Cobb.,97398,,true,false,false,JerShon,,Cobb,,NW,,5,7,3,1,1,,,,,0,,2,Shooting,8,Foul,,,,78,78,
1,15,54,Lenzelle Smith Jr. makes free throw 1 of 2.,97510,,true,false,false,Lenzelle,,Smith Jr.,,OhioSt,,6,7,3,1,0,,,,,2,1,11,Free Throw 1 of 2,1,Free Throw Made,,,,79,79,
1,15,54,Lenzelle Smith Jr. makes free throw 2 of 2.,97510,,true,false,false,Lenzelle,,Smith Jr.,,OhioSt,,7,7,3,1,0,,,,,3,1,12,Free Throw 2 of 2,1,Free Throw Made,,,,79,79,
1,15,39,Drew Crawford makes a jump shot from 11 feet out.,88698,,true,false,false,Drew,,Crawford,,NW,,7,9,3,1,0,,,,,5,2,45,Jump Shot,3,Field Goal Made,11,9.8,5.2,78,78,
1,15,15,Lenzelle Smith Jr. misses a 3-point jump shot from 22 feet out.,97510,,true,false,false,Lenzelle,,Smith Jr.,,OhioSt,,7,9,3,1,0,,,,,3,3,45,Jump Shot,4,Field Goal Missed,22,22,3.6,79,79,
1,15,15,Nikola Cerina with a defensive rebound.,88767,,true,false,false,Nikola,,Cerina,,NW,,7,9,3,1,0,,,,,0,,,,6,Defensive Rebound,,,,78,78,
1,14,59,Sanjay Lumpkin misses a 3-point jump shot from 25 feet out.,116200,,true,false,false,Sanjay,,Lumpkin,,NW,,7,9,3,1,0,,,,,0,3,45,Jump Shot,4,Field Goal Missed,25,11.5,21.7,78,78,
1,14,59,Lenzelle Smith Jr. with a defensive rebound.,97510,,true,false,false,Lenzelle,,Smith Jr.,,OhioSt,,7,9,3,1,0,,,,,3,,,,6,Defensive Rebound,,,,79,79,
1,14,45,Shooting foul committed by Nikola Cerina.,88767,,true,false,false,Nikola,,Cerina,,NW,,7,9,4,1,1,,,,,0,,2,Shooting,8,Foul,,,,78,78,
1,14,45,LaQuinton Ross makes free throw 1 of 2.,110161,,true,false,false,LaQuinton,,Ross,,OhioSt,,8,9,4,1,0,,,,,1,1,11,Free Throw 1 of 2,1,Free Throw Made,,,,79,79,
1,14,45,LaQuinton Ross makes free throw 2 of 2.,110161,,true,false,false,LaQuinton,,Ross,,OhioSt,,9,9,4,1,0,,,,,2,1,12,Free Throw 2 of 2,1,Free Throw Made,,,,79,79,
1,14,23,Tre Demps with a palming turnover turnover: Palming Turnover,109549,,true,false,false,Tre,,Demps,,NW,,9,9,4,1,0,,,,,0,,21,Palming Turnover,7,Turnover,,,,78,78,
1,14,14,LaQuinton Ross misses a 3-point jump shot from 24 feet out.,110161,,true,false,false,LaQuinton,,Ross,,OhioSt,,9,9,4,1,0,,,,,2,3,45,Jump Shot,4,Field Goal Missed,24,-11,21,79,79,
1,14,14,NW with a defensive rebound.,,,false,false,false,,,,,,,9,9,4,1,0,,,,,0,,,,6,Defensive Rebound,,,,78,78,
1,13,53,Drew Crawford with a lost ball turnover: Lost Ball,88698,,true,false,false,Drew,,Crawford,,NW,,9,9,4,1,0,,,,,5,,2,Lost Ball,7,Turnover,,,,78,78,
1,13,43,Amedeo Della Valle misses a layup shot.,116594,,true,false,false,Amedeo,,Della Valle,,OhioSt,,9,9,4,1,0,,,,,0,2,40,Layup Shot,4,Field Goal Missed,0,0,0,79,79,
1,13,43,JerShon Cobb with a defensive rebound.,97398,,true,false,false,JerShon,,Cobb,,NW,,9,9,4,1,1,,,,,0,,,,6,Defensive Rebound,,,,78,78,
1,13,40,JerShon Cobb misses a 3-point jump shot from 24 feet out.,97398,,true,false,false,JerShon,,Cobb,,NW,,9,9,4,1,1,,,,,0,3,45,Jump Shot,4,Field Goal Missed,24,15.9,17.9,78,78,
1,13,40,LaQuinton Ross with a defensive rebound.,110161,,true,false,false,LaQuinton,,Ross,,OhioSt,,9,9,4,1,0,,,,,2,,,,6,Defensive Rebound,,,,79,79,
1,13,23,Amedeo Della Valle misses a 3-point jump shot from 22 feet out.,116594,,true,false,false,Amedeo,,Della Valle,,OhioSt,,9,9,4,1,0,,,,,0,3,45,Jump Shot,4,Field Goal Missed,22,-15.9,15.2,79,79,
1,13,23,LaQuinton Ross with an offensive rebound.,110161,,true,false,false,LaQuinton,,Ross,,OhioSt,,9,9,4,1,0,,,,,2,,,,5,Offensive Rebound,,,,79,79,
1,13,03,Shannon Scott makes a jump shot from 15 feet out.,110162,,true,false,false,Shannon,,Scott,,OhioSt,,11,9,4,1,0,,,,,2,2,45,Jump Shot,3,Field Goal Made,15,-.8,15,79,79,
1,12,40,Alex Olah makes a hook shot from 8 feet out.,116199,,true,false,false,Alex,,Olah,,NW,,11,11,4,1,0,,,,,6,2,55,Hook Shot,3,Field Goal Made,8,-7.2,2.1,78,78,
1,12,25,LaQuinton Ross misses a layup shot.,110161,,true,false,false,LaQuinton,,Ross,,OhioSt,,11,11,4,1,0,,,,,2,2,40,Layup Shot,4,Field Goal Missed,0,0,0,79,79,
1,12,25,LaQuinton Ross with an offensive rebound.,110161,,true,false,false,LaQuinton,,Ross,,OhioSt,,11,11,4,1,0,,,,,2,,,,5,Offensive Rebound,,,,79,79,
1,12,22,LaQuinton Ross makes a tip shot from 2 feet out.,110161,,true,false,false,LaQuinton,,Ross,,OhioSt,,13,11,4,1,0,,,,,4,2,53,Tip Shot,3,Field Goal Made,2,-.4,2.1,79,79,
1,12,04,Shooting foul committed by Shannon Scott.,110162,,true,false,false,Shannon,,Scott,,OhioSt,,13,11,4,2,1,,,,,2,,2,Shooting,8,Foul,,,,79,79,
1,12,04,Tre Demps makes free throw 1 of 2.,109549,,true,false,false,Tre,,Demps,,NW,,13,12,4,2,0,,,,,1,1,11,Free Throw 1 of 2,1,Free Throw Made,,,,78,78,
1,12,04,Tre Demps misses free throw 2 of 2.,109549,,true,false,false,Tre,,Demps,,NW,,13,12,4,2,0,,,,,1,1,12,Free Throw 2 of 2,2,Free Throw Missed,,,,78,78,
1,12,04,Amir Williams with a defensive rebound.,110165,,true,false,false,Amir,,Williams,,OhioSt,,13,12,4,2,0,,,,,2,,,,6,Defensive Rebound,,,,79,79,
1,11,34,Aaron Craft makes a layup shot.,97508,,true,false,false,Aaron,,Craft,,OhioSt,,15,12,4,2,0,,,,,4,2,40,Layup Shot,3,Field Goal Made,0,0,0,79,79,
1,11,04,Sanjay Lumpkin makes a layup shot. Drew Crawford with the assist.,116200,88698,true,true,false,Sanjay,Drew,Lumpkin,Crawford,NW,NW,15,14,4,2,0,,,,,2,2,40,Layup Shot,3,Field Goal Made,0,0,0,78,78,
1,10,39,Shannon Scott with a lost ball turnover: Lost Ball,110162,,true,false,false,Shannon,,Scott,,OhioSt,,15,14,4,2,1,,,,,2,,2,Lost Ball,7,Turnover,,,,79,79,
1,10,33,Tre Demps makes a jump shot from 6 feet out.,109549,,true,false,false,Tre,,Demps,,NW,,15,16,4,2,0,,,,,3,2,45,Jump Shot,3,Field Goal Made,6,-3,5.2,78,78,
1,10,10,Marc Loving misses a 3-point jump shot from 24 feet out.,120814,,true,false,false,Marc,,Loving,,OhioSt,,15,16,4,2,0,,,,,0,3,45,Jump Shot,4,Field Goal Missed,24,16.2,18.3,79,79,
1,10,10,Amir Williams with an offensive rebound.,110165,,true,false,false,Amir,,Williams,,OhioSt,,15,16,4,2,0,,,,,2,,,,5,Offensive Rebound,,,,79,79,
1,10,06,Offensive foul committed by Shannon Scott.,110162,,true,false,false,Shannon,,Scott,,OhioSt,,15,16,4,3,2,,,,,2,,4,Offensive,8,Foul,,,,79,79,
1,10,06,Shannon Scott with a  turnover:,110162,,true,false,false,Shannon,,Scott,,OhioSt,,15,16,4,3,2,,,,,2,,,,7,Turnover,,,,79,79,
1,10,06,Official TV timeout.,,,false,false,false,,,,,,,15,16,4,3,0,,,,,0,,3,Official TV,11,Timeout,,,,79,79,
1,9,35,Drew Crawford makes a jump shot from 17 feet out.,88698,,true,false,false,Drew,,Crawford,,NW,,15,18,4,3,0,,,,,7,2,45,Jump Shot,3,Field Goal Made,17,-8.8,14.2,78,78,
1,9,05,Shooting foul committed by Dave Sobolewski.,109548,,true,false,false,Dave,,Sobolewski,,NW,,15,18,5,3,1,,,,,0,,2,Shooting,8,Foul,,,,78,78,
1,9,05,Amedeo Della Valle misses free throw 1 of 2.,116594,,true,false,false,Amedeo,,Della Valle,,OhioSt,,15,18,5,3,0,,,,,0,1,11,Free Throw 1 of 2,2,Free Throw Missed,,,,79,79,
1,9,05,OhioSt with an offensive rebound.,,,false,false,false,,,,,,,15,18,5,3,0,,,,,0,,,,5,Offensive Rebound,,,,79,79,
1,9,05,Amedeo Della Valle makes free throw 2 of 2.,116594,,true,false,false,Amedeo,,Della Valle,,OhioSt,,16,18,5,3,0,,,,,1,1,12,Free Throw 2 of 2,1,Free Throw Made,,,,79,79,
1,8,38,Drew Crawford makes a 3-point jump shot from 24 feet out.,88698,,true,false,false,Drew,,Crawford,,NW,,16,21,5,3,0,,,,,10,3,45,Jump Shot,3,Field Goal Made,24,-.9,23.9,78,78,
1,8,15,Marc Loving misses a jump shot from 8 feet out.,120814,,true,false,false,Marc,,Loving,,OhioSt,,16,21,5,3,0,,,,,0,2,45,Jump Shot,4,Field Goal Missed,8,.8,7.9,79,79,
1,8,15,JerShon Cobb with a defensive rebound.,97398,,true,false,false,JerShon,,Cobb,,NW,,16,21,5,3,1,,,,,0,,,,6,Defensive Rebound,,,,78,78,
1,8,03,Drew Crawford misses a 3-point jump shot from 23 feet out.,88698,,true,false,false,Drew,,Crawford,,NW,,16,21,5,3,0,,,,,10,3,45,Jump Shot,4,Field Goal Missed,23,-22.7,1.3,78,78,
1,8,03,Aaron Craft with a defensive rebound.,97508,,true,false,false,Aaron,,Craft,,OhioSt,,16,21,5,3,0,,,,,4,,,,6,Defensive Rebound,,,,79,79,
1,7,56,Aaron Craft misses a layup shot.,97508,,true,false,false,Aaron,,Craft,,OhioSt,,16,21,5,3,0,,,,,4,2,40,Layup Shot,4,Field Goal Missed,0,0,0,79,79,
1,7,56,Tre Demps with a defensive rebound.,109549,,true,false,false,Tre,,Demps,,NW,,16,21,5,3,0,,,,,3,,,,6,Defensive Rebound,,,,78,78,
1,7,50,Tre Demps makes a layup shot.,109549,,true,false,false,Tre,,Demps,,NW,,16,23,5,3,0,,,,,5,2,40,Layup Shot,3,Field Goal Made,0,0,0,78,78,
1,7,43,Personal foul committed by Sanjay Lumpkin.,116200,,true,false,false,Sanjay,,Lumpkin,,NW,,16,23,6,3,1,,,,,2,,1,Personal,8,Foul,,,,78,78,
1,7,43,Official TV timeout.,,,false,false,false,,,,,,,16,23,6,3,0,,,,,0,,3,Official TV,11,Timeout,,,,79,79,
1,7,34,Offensive foul committed by LaQuinton Ross.,110161,,true,false,false,LaQuinton,,Ross,,OhioSt,,16,23,6,4,1,,,,,4,,4,Offensive,8,Foul,,,,79,79,
1,7,34,LaQuinton Ross with a  turnover:,110161,,true,false,false,LaQuinton,,Ross,,OhioSt,,16,23,6,4,1,,,,,4,,,,7,Turnover,,,,79,79,
1,7,20,Alex Olah makes a hook shot from 9 feet out. JerShon Cobb with the assist.,116199,97398,true,true,false,Alex,JerShon,Olah,Cobb,NW,NW,16,25,6,4,0,,,,,8,2,55,Hook Shot,3,Field Goal Made,9,8.6,1.8,78,78,
1,7,01,Aaron Craft makes a layup shot.,97508,,true,false,false,Aaron,,Craft,,OhioSt,,18,25,6,4,0,,,,,6,2,40,Layup Shot,3,Field Goal Made,0,0,0,79,79,
1,7,01,Shooting foul committed by Drew Crawford.,88698,,true,false,false,Drew,,Crawford,,NW,,18,25,7,4,1,,,,,10,,2,Shooting,8,Foul,,,,78,78,
1,7,01,Aaron Craft makes free throw 1 of 1.,97508,,true,false,false,Aaron,,Craft,,OhioSt,,19,25,7,4,0,,,,,7,1,10,Free Throw 1 of 1,1,Free Throw Made,,,,79,79,
1,6,30,Alex Olah misses a layup shot.,116199,,true,false,false,Alex,,Olah,,NW,,19,25,7,4,0,,,,,8,2,40,Layup Shot,4,Field Goal Missed,0,0,0,78,78,
1,6,30,LaQuinton Ross with a defensive rebound.,110161,,true,false,false,LaQuinton,,Ross,,OhioSt,,19,25,7,4,1,,,,,4,,,,6,Defensive Rebound,,,,79,79,
1,6,08,Lenzelle Smith Jr. makes a layup shot.,97510,,true,false,false,Lenzelle,,Smith Jr.,,OhioSt,,21,25,7,4,0,,,,,5,2,40,Layup Shot,3,Field Goal Made,0,0,0,79,79,
1,5,48,Drew Crawford makes a 3-point jump shot from 24 feet out.,88698,,true,false,false,Drew,,Crawford,,NW,,21,28,7,4,1,,,,,13,3,45,Jump Shot,3,Field Goal Made,24,-7.4,23,78,78,
1,5,28,LaQuinton Ross makes a jump shot from 5 feet out.,110161,,true,false,false,LaQuinton,,Ross,,OhioSt,,23,28,7,4,1,,,,,6,2,45,Jump Shot,3,Field Goal Made,5,4.3,3.3,79,79,
1,5,05,Drew Crawford misses a 3-point jump shot from 25 feet out.,88698,,true,false,false,Drew,,Crawford,,NW,,23,28,7,4,1,,,,,13,3,45,Jump Shot,4,Field Goal Missed,25,-.9,24.9,78,78,
1,5,05,Sanjay Lumpkin with an offensive rebound.,116200,,true,false,false,Sanjay,,Lumpkin,,NW,,23,28,7,4,1,,,,,2,,,,5,Offensive Rebound,,,,78,78,
1,5,02,Sanjay Lumpkin misses a layup shot.,116200,,true,false,false,Sanjay,,Lumpkin,,NW,,23,28,7,4,1,,,,,2,2,40,Layup Shot,4,Field Goal Missed,0,0,0,78,78,
1,5,02,NW with an offensive rebound.,,,false,false,false,,,,,,,23,28,7,4,0,,,,,0,,,,5,Offensive Rebound,,,,78,78,
1,5,01,Drew Crawford with a bad pass turnover: Bad Pass,88698,,true,false,false,Drew,,Crawford,,NW,,23,28,7,4,1,,,,,13,,1,Bad Pass,7,Turnover,,,,78,78,
1,4,50,LaQuinton Ross makes a 3-point jump shot from 24 feet out. Lenzelle Smith Jr. with the assist.,110161,97510,true,true,false,LaQuinton,Lenzelle,Ross,Smith Jr.,OhioSt,OhioSt,26,28,7,4,1,,,,,9,3,45,Jump Shot,3,Field Goal Made,24,-3.7,24.2,79,79,
1,4,19,Nikola Cerina misses a 3-point jump shot from 23 feet out.,88767,,true,false,false,Nikola,,Cerina,,NW,,26,28,7,4,1,,,,,0,3,45,Jump Shot,4,Field Goal Missed,23,-8.1,21.8,78,78,
1,4,19,Lenzelle Smith Jr. with a defensive rebound.,97510,,true,false,false,Lenzelle,,Smith Jr.,,OhioSt,,26,28,7,4,0,,,,,5,,,,6,Defensive Rebound,,,,79,79,
1,4,10,LaQuinton Ross makes a jump shot from 8 feet out.,110161,,true,false,false,LaQuinton,,Ross,,OhioSt,,28,28,7,4,1,,,,,11,2,45,Jump Shot,3,Field Goal Made,8,6.7,3.6,79,79,
1,4,08,NW take a 20-second timeout.,,,false,false,false,,,,,,,28,28,7,4,0,,,,,0,,2,Short,11,Timeout,,,,78,78,
1,3,34,JerShon Cobb misses a 3-point jump shot from 23 feet out.,97398,,true,false,false,JerShon,,Cobb,,NW,,28,28,7,4,1,,,,,0,3,45,Jump Shot,4,Field Goal Missed,23,-17.3,15,78,78,
1,3,34,Lenzelle Smith Jr. with a defensive rebound.,97510,,true,false,false,Lenzelle,,Smith Jr.,,OhioSt,,28,28,7,4,0,,,,,5,,,,6,Defensive Rebound,,,,79,79,
1,3,28,Lenzelle Smith Jr. makes a jump shot from 7 feet out.,97510,,true,false,false,Lenzelle,,Smith Jr.,,OhioSt,,30,28,7,4,0,,,,,7,2,45,Jump Shot,3,Field Goal Made,7,-6.2,2.6,79,79,
1,2,50,Tre Demps makes a 3-point jump shot from 23 feet out. Nikola Cerina with the assist.,109549,88767,true,true,false,Tre,Nikola,Demps,Cerina,NW,NW,30,31,7,4,0,,,,,8,3,45,Jump Shot,3,Field Goal Made,23,20,10.8,78,78,
1,2,33,Trey McDonald makes a layup shot. Lenzelle Smith Jr. with the assist.,110160,97510,true,true,false,Trey,Lenzelle,McDonald,Smith Jr.,OhioSt,OhioSt,32,31,7,4,0,,,,,2,2,40,Layup Shot,3,Field Goal Made,0,0,0,79,79,
1,2,20,Personal foul committed by Lenzelle Smith Jr..,97510,,true,false,false,Lenzelle,,Smith Jr.,,OhioSt,,32,31,7,5,1,,,,,7,,1,Personal,8,Foul,,,,79,79,
1,2,20,Official TV timeout.,,,false,false,false,,,,,,,32,31,7,5,0,,,,,0,,3,Official TV,11,Timeout,,,,79,79,
1,1,55,JerShon Cobb with a lost ball turnover: Lost Ball,97398,,true,false,false,JerShon,,Cobb,,NW,,32,31,7,5,1,,,,,0,,2,Lost Ball,7,Turnover,,,,78,78,
1,1,44,Shooting foul committed by Alex Olah.,116199,,true,false,false,Alex,,Olah,,NW,,32,31,8,5,1,,,,,8,,2,Shooting,8,Foul,,,,78,78,
1,1,44,LaQuinton Ross makes free throw 1 of 2.,110161,,true,false,false,LaQuinton,,Ross,,OhioSt,,33,31,8,5,1,,,,,12,1,11,Free Throw 1 of 2,1,Free Throw Made,,,,79,79,
1,1,44,LaQuinton Ross makes free throw 2 of 2.,110161,,true,false,false,LaQuinton,,Ross,,OhioSt,,34,31,8,5,1,,,,,13,1,12,Free Throw 2 of 2,1,Free Throw Made,,,,79,79,
1,1,06,Tre Demps misses a jump shot from 6 feet out.,109549,,true,false,false,Tre,,Demps,,NW,,34,31,8,5,0,,,,,8,2,45,Jump Shot,4,Field Goal Missed,6,-.1,6.4,78,78,
1,1,06,Alex Olah with an offensive rebound.,116199,,true,false,false,Alex,,Olah,,NW,,34,31,8,5,1,,,,,8,,,,5,Offensive Rebound,,,,78,78,
1,1,01,Alex Olah misses a layup shot.,116199,,true,false,false,Alex,,Olah,,NW,,34,31,8,5,1,,,,,8,2,40,Layup Shot,4,Field Goal Missed,0,0,0,78,78,
1,1,01,LaQuinton Ross with a defensive rebound.,110161,,true,false,false,LaQuinton,,Ross,,OhioSt,,34,31,8,5,1,,,,,13,,,,6,Defensive Rebound,,,,79,79,
1,0,53.9,Sam Thompson makes a 3-point jump shot from 23 feet out. Aaron Craft with the assist.,110164,97508,true,true,false,Sam,Aaron,Thompson,Craft,OhioSt,OhioSt,37,31,8,5,1,,,,,3,3,45,Jump Shot,3,Field Goal Made,23,19.1,13.5,79,79,
1,0,33.1,JerShon Cobb makes a jump shot from 17 feet out.,97398,,true,false,false,JerShon,,Cobb,,NW,,37,33,8,5,1,,,,,2,2,45,Jump Shot,3,Field Goal Made,17,-2.8,16.7,78,78,
1,0,04.0,Aaron Craft misses a 3-point jump shot from 23 feet out.,97508,,true,false,false,Aaron,,Craft,,OhioSt,,37,33,8,5,0,,,,,7,3,45,Jump Shot,4,Field Goal Missed,23,7,22,79,79,
1,0,04.0,NW with a defensive rebound.,,,false,false,false,,,,,,,37,33,8,5,0,,,,,0,,,,6,Defensive Rebound,,,,78,78,
1,0,04.0,OhioSt take a 20-second timeout.,,,false,false,false,,,,,,,37,33,8,5,0,,,,,0,,2,Short,11,Timeout,,,,79,79,
1,0,00,End of the 1st Half,,,false,false,false,,,,,,,37,33,8,5,0,,,,,0,,,,15,End Period,,,,79,79,
2,20,00,Start of the 2nd Half,,,false,false,false,,,,,,,37,33,0,0,0,,,,,0,,,,14,Start Period,,,,79,79,
2,19,51,Personal foul committed by Lenzelle Smith Jr..,97510,,true,false,false,Lenzelle,,Smith Jr.,,OhioSt,,37,33,0,1,2,,,,,7,,1,Personal,8,Foul,,,,79,79,
2,19,42,Drew Crawford misses a 3-point jump shot from 25 feet out.,88698,,true,false,false,Drew,,Crawford,,NW,,37,33,0,1,1,,,,,13,3,45,Jump Shot,4,Field Goal Missed,25,22.7,11,78,78,
2,19,42,Amir Williams with a defensive rebound.,110165,,true,false,false,Amir,,Williams,,OhioSt,,37,33,0,1,0,,,,,2,,,,6,Defensive Rebound,,,,79,79,
2,19,38,Shooting foul committed by Drew Crawford.,88698,,true,false,false,Drew,,Crawford,,NW,,37,33,1,1,2,,,,,13,,2,Shooting,8,Foul,,,,78,78,
2,19,38,Aaron Craft makes free throw 1 of 2.,97508,,true,false,false,Aaron,,Craft,,OhioSt,,38,33,1,1,0,,,,,8,1,11,Free Throw 1 of 2,1,Free Throw Made,,,,79,79,
2,19,38,Aaron Craft makes free throw 2 of 2.,97508,,true,false,false,Aaron,,Craft,,OhioSt,,39,33,1,1,0,,,,,9,1,12,Free Throw 2 of 2,1,Free Throw Made,,,,79,79,
2,19,17,Drew Crawford misses a jump shot from 13 feet out.,88698,,true,false,false,Drew,,Crawford,,NW,,39,33,1,1,2,,,,,13,2,45,Jump Shot,4,Field Goal Missed,13,12.7,1.1,78,78,
2,19,17,Sam Thompson with a defensive rebound.,110164,,true,false,false,Sam,,Thompson,,OhioSt,,39,33,1,1,1,,,,,3,,,,6,Defensive Rebound,,,,79,79,
2,19,05,Sam Thompson makes a 3-point jump shot from 23 feet out. Lenzelle Smith Jr. with the assist.,110164,97510,true,true,false,Sam,Lenzelle,Thompson,Smith Jr.,OhioSt,OhioSt,42,33,1,1,1,,,,,6,3,45,Jump Shot,3,Field Goal Made,23,18.3,13.5,79,79,
2,19,03,NW take a full timeout.,,,false,false,false,,,,,,,42,33,1,1,0,,,,,0,,1,Regular,11,Timeout,,,,78,78,
2,18,52,JerShon Cobb with a lost ball turnover: Lost Ball,97398,,true,false,false,JerShon,,Cobb,,NW,,42,33,1,1,1,,,,,2,,2,Lost Ball,7,Turnover,,,,78,78,
2,18,48,Lenzelle Smith Jr. makes a dunk shot. Sam Thompson with the assist.,97510,110164,true,true,false,Lenzelle,Sam,Smith Jr.,Thompson,OhioSt,OhioSt,44,33,1,1,2,,,,,9,2,48,Dunk Shot,3,Field Goal Made,0,0,0,79,79,
2,18,20,Alex Olah with a lost ball turnover: Lost Ball,116199,,true,false,false,Alex,,Olah,,NW,,44,33,1,1,1,,,,,8,,2,Lost Ball,7,Turnover,,,,78,78,
2,18,10,Personal foul committed by JerShon Cobb.,97398,,true,false,false,JerShon,,Cobb,,NW,,44,33,2,1,2,,,,,2,,1,Personal,8,Foul,,,,78,78,
2,18,10,Personal foul committed by Drew Crawford.,88698,,true,false,false,Drew,,Crawford,,NW,,44,33,3,1,3,,,,,13,,1,Personal,8,Foul,,,,78,78,
2,18,07,Amir Williams misses a dunk shot.,110165,,true,false,false,Amir,,Williams,,OhioSt,,44,33,3,1,0,,,,,2,2,48,Dunk Shot,4,Field Goal Missed,0,0,0,79,79,
2,18,07,Lenzelle Smith Jr. with an offensive rebound.,97510,,true,false,false,Lenzelle,,Smith Jr.,,OhioSt,,44,33,3,1,2,,,,,9,,,,5,Offensive Rebound,,,,79,79,
2,18,06,Lenzelle Smith Jr. misses a layup shot.,97510,,true,false,false,Lenzelle,,Smith Jr.,,OhioSt,,44,33,3,1,2,,,,,9,2,40,Layup Shot,4,Field Goal Missed,0,0,0,79,79,
2,18,06,Lenzelle Smith Jr. with an offensive rebound.,97510,,true,false,false,Lenzelle,,Smith Jr.,,OhioSt,,44,33,3,1,2,,,,,9,,,,5,Offensive Rebound,,,,79,79,
2,18,04,Personal foul committed by Sanjay Lumpkin.,116200,,true,false,false,Sanjay,,Lumpkin,,NW,,44,33,4,1,2,,,,,2,,1,Personal,8,Foul,,,,78,78,
2,17,50,Personal foul committed by Tre Demps.,109549,,true,false,false,Tre,,Demps,,NW,,44,33,5,1,1,,,,,8,,1,Personal,8,Foul,,,,78,78,
2,17,43,Lenzelle Smith Jr. misses a jump shot from 7 feet out.,97510,,true,false,false,Lenzelle,,Smith Jr.,,OhioSt,,44,33,5,1,2,,,,,9,2,45,Jump Shot,4,Field Goal Missed,7,-5.5,3.8,79,79,
2,17,43,Alex Olah with a defensive rebound.,116199,,true,false,false,Alex,,Olah,,NW,,44,33,5,1,1,,,,,8,,,,6,Defensive Rebound,,,,78,78,
2,17,34,JerShon Cobb misses a 3-point jump shot from 23 feet out.,97398,,true,false,false,JerShon,,Cobb,,NW,,44,33,5,1,2,,,,,2,3,45,Jump Shot,4,Field Goal Missed,23,-5.9,21.8,78,78,
2,17,34,LaQuinton Ross with a defensive rebound.,110161,,true,false,false,LaQuinton,,Ross,,OhioSt,,44,33,5,1,1,,,,,13,,,,6,Defensive Rebound,,,,79,79,
2,17,16,Sam Thompson makes a jump shot from 15 feet out. Aaron Craft with the assist.,110164,97508,true,true,false,Sam,Aaron,Thompson,Craft,OhioSt,OhioSt,46,33,5,1,1,,,,,8,2,45,Jump Shot,3,Field Goal Made,15,-12.8,8.4,79,79,
2,16,58,Sanjay Lumpkin misses a layup shot.,116200,,true,false,false,Sanjay,,Lumpkin,,NW,,46,33,5,1,2,,,,,2,2,40,Layup Shot,4,Field Goal Missed,0,0,0,78,78,
2,16,58,NW with an offensive rebound.,,,false,false,false,,,,,,,46,33,5,1,0,,,,,0,,,,5,Offensive Rebound,,,,78,78,
2,16,42,JerShon Cobb makes a jump shot from 17 feet out.,97398,,true,false,false,JerShon,,Cobb,,NW,,46,35,5,1,2,,,,,4,2,45,Jump Shot,3,Field Goal Made,17,-12.5,11.6,78,78,
2,16,19,Sam Thompson makes a 3-point jump shot from 23 feet out. Aaron Craft with the assist.,110164,97508,true,true,false,Sam,Aaron,Thompson,Craft,OhioSt,OhioSt,49,35,5,1,1,,,,,11,3,45,Jump Shot,3,Field Goal Made,23,22.2,5.3,79,79,
2,15,43,Shooting foul committed by Amir Williams.,110165,,true,false,false,Amir,,Williams,,OhioSt,,49,35,5,2,1,,,,,2,,2,Shooting,8,Foul,,,,79,79,
2,15,43,Official TV timeout.,,,false,false,false,,,,,,,49,35,5,2,0,,,,,0,,3,Official TV,11,Timeout,,,,79,79,
2,15,39,Drew Crawford with a lost ball turnover: Lost Ball,88698,,true,false,false,Drew,,Crawford,,NW,,49,35,5,2,3,,,,,13,,2,Lost Ball,7,Turnover,,,,78,78,
2,15,23,Personal foul committed by Sanjay Lumpkin.,116200,,true,false,false,Sanjay,,Lumpkin,,NW,,49,35,6,2,3,,,,,2,,1,Personal,8,Foul,,,,78,78,
2,15,18,Personal foul committed by Nikola Cerina.,88767,,true,false,false,Nikola,,Cerina,,NW,,49,35,7,2,2,,,,,0,,1,Personal,8,Foul,,,,78,78,
2,15,18,Personal foul committed by Amir Williams.,110165,,true,false,false,Amir,,Williams,,OhioSt,,49,35,7,3,2,,,,,2,,1,Personal,8,Foul,,,,79,79,
2,15,08,Personal foul committed by Nikola Cerina.,88767,,true,false,false,Nikola,,Cerina,,NW,,49,35,8,3,3,,,,,0,,1,Personal,8,Foul,,,,78,78,
